name,rating,review
Matteo S.,5,Matthew was able to take my song and bring it to the next level. His production was spot on and I am happy to say that my voice never sounded better. He was easy to work with and great at always communicating with me and sending me the latest version of what he was working on. Will definitely use again.
Opero,5,I asked Matthew Tryba to give me some production advices and answer to my general questions about the music industry (as consultant). His answers were good and helpful. I would definitely come back to him for other jobs.
Louis Torre,5,Matthew was extremely patient with me and crafted a song that is a standout on my album. I gave him a reference song and he created a song with the same vibe. Highly recommend him! Cannot wait to make more records together !
Lindsey Leigh,5,"I came to Matt after being frustrated with other producers putting their own spin on my music instead of listening to what my needs were musically. He has a great way of capitalizing on your strengths and building off of your writing style. He exceeded my expectations and was very helpful through the recording process. Thank you, Matt!"
Ted N.,5,Matt is superb. He is super professional and prompt with his delivery! 
Michael P.,5,"Matt was excellent and very professional to work with. Easy communicator, very skillful, and always made sure I was pleased every step of the way. I would highly recommend him and look forward to continue working with him."
Stefan,5,Matthew is a great producer who knows what he’s doing and can deliver high quality results in a short timeframe.
p!q,5,"this is my second time working with Matthew , and its been a pleasure working with him on both occasions . Matthew is highly talented , and professional and has a bright future ahead of him , and I would definitely recommend working with him"
Ryan B.,5,Quick response and on time delivery. Will work with him again. Very professional. I even received a voice note to ensure I understand the completed project.
Jazelle Paris,5,Matthew was great to work with! Talented and thorough articulate communication which allowed for a smooth painless work flow. Would definitely collab with him again in the future!
p!q,5,"this is my first time working with Matthew , and I can see why hes been able to work with the likes of taylor swift , maroon 5 and one republic . I found Matthew to be an extremely talented young producer . Matthew is also very patient, and understanding with a great ear for what works .pound for pound one of the best producers here on soundbetter"
Eguala,5,Second time I work with Matthew and second time are very pleased with the final sound of my mix. Very proffessional and hard working. Always has solutions for everything. I would recommend anyone working with him. Thank you Matthew.
Lindsey Leigh,5,Matt is always my #1 choice for my music-I wouldn't trust many others with something so important to me! The amount of clients he has means he's doing something right. He always conducts himself professionally and in positive way. Thank you Matt!
Cynthia V.,5,"Matthew is an amazing producer, easy to work with and very talented. I'm looking forward to work with him on future projects"