name,rating,review
Sarantos,5,Fantastic and very easy to work with. Always goes the extra mile.
Dianna L.,5,Absolutely. One of the best producers in the music industry very talented courteous and super cool.
Sarantos,5,Pleasure to work with and very quick and responsive!
Leo C.,5,"Matthew did such a great job!! This is the second time we have worked together, he really finds the best in songs and is a great producer to work with!! 10/10"
Hunter M.,5,Matthew is the best vocal producer I've found - his ear training is unmatched and he knows all the nuances and small details / tweaks needed in a vocal performance to bring out the best in you and for the song. If you are serious about your song and want it the strongest it can be he is your guy!
Hunter,5,"Matthew really knows his stuff, did an amazing and helpful job getting my vocal chain dialed in. Thank you!"
Dianna L.,5,"Matthew is an absolute Joy to work with. He produced an amazing single for our female artist. He is professional, accommodating and a very talented producer. We will defninitely work with him again in the near future."
Sarantos,5,Class act and an absolute pro! Totally worth it and very easy to work with.
Matthias K.,5,"Matthew is extremely talented, diligent and professional. He implements feedback quickly and has a great ear for detail. I'm very happy with the production quality of my song. Highly recommended!"
Ricky S.,5,Working with Matthew was fantastic. He really understands pop music and was able to really collaborate with me to achieve the sound I was looking for and present a really cool and polished sounding track as well as vocal mix. Highly receptive to all my notes and great to have him for every step of the process. I think we created something really great together.
Garen C.,5,Matthew has the great talent to achieve the goal that you request. He is the best choice!
Alexander Muravyev,5,It was an unforgettable experience working together with Matt. I am very grateful for the exceptional professionalism and musical creativity that helped to make a cool project.
Elliot Saldivar,5,Matthew worked with me and my budget. He mastered one of my mixes and gave it that extra oomph that it needed.
Christian,5,"Matthew is absolutely incredible. He has a keen ear for production, and he fully understands my artistic vision. He is both personable and professional, which makes it very easy to work with him. I truly couldn’t have asked for a better producer, and I’m looking forward to collaborating with him again in the very near future!"
Leo C.,5,"Matt is such a pro! Did a flawless job on our first single production together, can't wait to continue working together. Easy to communicate, and great to work with. 5/5 Stars!"
Michael Ländin,5,Matthew is - as usual - great to work with. Fast delivery and perfect performance
Sanesia A. Tillman,5,I really enjoyed working with Matthew! He was always available to answer any questions that I had. He knew the exact sound that he was going for for his Artist's song and was able to communicate that through clear instructions so that I knew exactly how to deliver. It has been a pleasure working with him and I hope to work with him again in the future!
Henry K.,5,"Matt has been extremely helpful and patient through out the process, it’s the second we worked together and both experiences are just amazing. He’s really professional and was able to meet our needs in ways we asked for. The mixes sounds really awesome and worth every cents. We’d definitely come back in the future to work with him again!"
AYLA,5,"Matthew is AMAZING!MY FAVORITE PRODUCER ON THIS PLANET!!! He takes every song to the next level, understands my ideas exactly, makes everything sound sooo professional and explains me how he produces so I can try do more by myself... I've learned sooo much from working with him and had a lot of fun and got suuuuuper results. Working with him is more than an upgrade to your music! (lot's of endorphins guaranteed)"
ZackSympsonMusic,5,Matthew is an amazing producer/mix engineer. I highly recomend him and will be working with him again in the future !!
Tayla Jayde,5,"I had a great experience working with Matt. He is such a talent. He took my references and understood the direction I wanted to go in and provided me with regular updates to where the song was at. Super happy with the end result. Highly recommend!"
Justine G.,5,Very skilled and cares about giving you a track you really love! He offered some great advice as well as a wonderful song at the end. I'd definitely recommend him and would hire him again!
Eric Cano,5,Highly recommend period!!!
George,5,An absolute amazing mixing and mastering job by Matthew! Always does a fantastic job!
Sasha,5,Wrapped up out 4th song together and I would recommend Matthew to anyone who would like to bring their art to life!
Shane H.,5,"Matthew is a true professional, and extremely skilled. He will give your track a modern and unique sound that you'll be proud to release. He receives feedback well and will work to make your vision happen."
Eguala,5,It's been great working with Matthew! I have learnt a lot during the process and I am really happy with the final result! He controls technology more than anyone!
Franky De Coninck,5,"Real professional, wonderful translation of my desires and ideas. I am very happy I found Matthew through Soundbetter!"
Phil H.,5,We used Matthew to help our daughter Maya with her original song by arranging and producing the backing for her. He was awesome to work with and was able to create something they both could connect with. The song sounds amazing. We cannot thank him enough. Would fully recommend working with Matthew.
Sam Theller,5,"Matthew Tryba has been just amazing. I ran across Soundbetter and really did my research on the mixers, engineers, producers and I ended up picking Mr Tryba out of the whole bunch. Man, did I make the right choice. Matthews professionalism, skill set, project management and imagination are second to none. I just couldn't be more happier. Not only do I have a great track now, I have a new friend. I wouldn't even hesitate to work with Matthew Tryba again. No question!!"
Caroline L.,5,Matt is very professional and very talented which is all you need in this business. My track sounds amazing thanks to him.
Sydney Clemenson,5,"Matthew's creativity in production was fresh and unique. He was so on point with capturing my vision and what the song needed to come to life, and the collaboration was great. I highly recommend working with him!"
Erin Kelly,5,"Matthew has been outstanding. We love working with him. So nice to operate with someone having legit musicality and technical chops. Highly recommend!!!"
Convergent R.,5,"Awesome experience, again"
Michael Brandmeier,5,"Great mixer, great producer ear, great results . . . .PRO all the way."
Silver Street,5,Matthew followed direction and delivered exactly what I asked for. Will definitely work with him again.
Convergent R.,5,"Very kind, patient and helpful, we´ll work again with him!"
Thomas C.,5,Matthew is a wizard! He completely got what I was trying to achieve. He was able to polish up the vocals beyond what I thought was even possible!
Cameron Liddell,5,Another great song in a different genre. Thanks as always!
Michael Brandmeier,5,"As talented as Matthew is as a producer, he is also easy to work with; whatever it takes to get it done right. A pleasure!"
Michael Brandmeier,5,"Matthew is just great. I wanted a stripped-down production of a pop tune of mine; he nailed it the first shot. A very talented producer, excellent arranger, great feel, and musical sensibilities; he's extremely easy to work with and quick as well."
Jack M.,5,He went above and beyond to answer my questions. Professional and grounded. The meeting was worth my time and money.
Cody G,5,Matthew was very professional! Made my song sound amazing! He really helped my music sound more professional. I would recommend him to anyone.
Douglas Arruda,5,"Matthew did an outstanding job revising my work and giving feedback and suggestions on my lyrics. The completeness of his analysis helped me taking critical decisions to improve quality. It was a superb work, couldn’t be more satisfied. Matt is an accomplished producer, highly recommended!"
Sasha,5,"My 2nd finished track with Matthew and I love it! Very professional, creative, and enjoyable to work with. Would recommend for anyone looking to give life to their visions on songs. Now working on the 3rd track just because!"
Mimi,5,Really enjoyed working with Matthew and am very excited about the song we worked on! He has a magic touch and I look forward to working with him again in the near future. Thank you Matthew!!
jFEROcious,5,"When we got down to business Matthew was a machine. Created an entirely new vision for the song, and took care of feedback & notes asap. If you're reading these and ready to move... hire him! Do it!"
Cameron Liddell,5,"Matthew is 10/10, if you don't pick him, you’re picking the wrong producer. Thanks again!"
Zaiden Rendon,5,Magic worker
Ashton Kyle Elvis,5,Matthew killed it again! This was my second time working with him and he always delivers top-notch quality and makes my songs sound better than I imagined!
Luc,5,Matthew is awesome to work with! 5 solid stars.
AYLA,5,"I am very happy with the results!!! Matthew worked with a lot of dedication and devotion. It was easy to communicate with Matthew, as he is very fast in understanding my ideas. He is a very talented guitarist as well. To work with Matthew means to work with a professional musician and producer who will bring your song to its best level. I can only recommend him, and if I could I would give him 10 stars!!!"
ABRAHAM D.,5,Matthew is really talented. He has great hears for songs. He is able to find the elements that would take your songs to the next level. Highly recommended!!!
Harrieta,5,Was a pleasure working with Mathew. Very experienced producer. I look forward to us working together again!
Zaiden Rendon,5,Great work as always!
newkidsdj,5,Great producer and easy to communicate with. Great experience.
Zaiden Rendon,5,"6 or 7 stars, wheres that button at ???"
Cameron Liddell,5,"Consistently worked with Matthew over the years. He’s amazing at what he does, you won’t be disappointed working with him."
Sasha,5,Really happy with the first track we've worked together. Matthew is really a team player and did everything as best he could to make the song unique. This is the 2nd project we work together and will be continuing to work on the 3rd one as well
Sasha,5,Matthew was a great visionary! Really brought the song I've written to life and was a dream to work with. Professional and patient. Really gave his own stamp on the song that needed direction. I will be continuing to work with him on future projects!
Farin Kautz,5,Incredibly talented. It was definitely clear early on that we were working with a professional.
aliensdontringdoorbells,5,"We did a 5 piece band recording, production and mixing with Matthew. We enjoyed working in the studio with Matt; it all happens very quickly as Matt is very good at Protools. Most importantly thought is that he has a good ear and produced a world class song for our new album. Highly Recommended"
Josh Dreon,5,Matt was great to work with. He understood the vision of the song and turned it into an amazing track. It's clear he is very experienced with production based on what he delivers. Highly recommend.
Zaiden Rendon,5,This guy... magic tweaks
Lisa D.,5,"Mathew I am so grateful to have met you and honoured to have worked with you. So professional, positive and talented. We produced 5 songs together and I am super excited to take them back to Australia"
Andrea,5,So wonderful to work with! Beyond impressed with the track quality and turnaround time. Matthew’s communication was clear and timely. I was looking to create a track with more of a darker/ethereal vibe and wasn't sure if this fell within his realm of musical interest. The final product greatly exceeded my expectations. He executed it PERFECTLY with very minimal revising. He’s ridiculously talented and I'm very excited to work with him on future projects!
Cameron Liddell,5,"I’ve worked with Matthew for over a year now and will continue to work with him for many reasons. The biggest factor is that he continues to exceed my expectations. Not only is he an amazing producer, but he is an incredible engineer. Highly recommended."
Leonie Persch,5,I am very proud of what I’ve been working on with Matthew over the last few months and would definitely work with him again for my next project.
Leonie Persch,5,Matthew quickly adapted to the style I was looking for but also put in his own style to the tracks which made the songs sound unique.
Leonie Persch,5,"Matthew is a very talented, creative mind with impressing references. He knew exactly how to turn a raw draft into an outstanding, perfectly produced and beautiful piece of art. I was very impressed by Matthews outstanding talent for arrangement."
Leonie Persch,5,It was such a pleasure to work with Matthew. I loved working in his studio and the work flow was fantastic from the beginning. He implemented every of my wishes on my original songs in a way I couldn’t imagine any better.
Gabriel St. Juste,5,Good job my friend.
Cameron Liddell,5,I’ve been working with Matthew for the past year and have done almost a full album with him. He is constistantly excellent and is brilliant as what he does.
Cameron Liddell,5,Matthew is the best. He helped me see my project from start to finish and i have nothing but great things to say about him. Highly recommend.
Blake F.,5,Matt is such an incredible guy! I learned so much from him. He is so detail oriented and has a fantastic ear! The track turned out incredible. He does amazing work and I cannot recommend him enough!! Thanks so much man 
Ane E.,5,"Very professional and extremely talented producer! So grateful to have found Matthew on SoundBetter. Thank you so much, Matt, for making my song sound top notch!"
Cameron Liddell,5,"I’ve done an EP work of songs with Matthew now and every song is exactly what I’ve been looking for. Phenomenal producer, know what to do to make a good song great."
Gina,5,Matthew is incredible and super professional!
Mati,5,Matthew is a very talented & creative Producer and is really great to work with! I recommend Matthew very highly to any Artists that is looking to get an Amazing song but also work with a Producer who truly cares about the Artist's vision.
Mariano Schiavolini,5,"Great producer, and very attentive to detail. Recommended!"
Ryan S.,5,Matthew was great to work with. He nailed the sound we were looking for. Hope to work with him again.
Lucas James,5,Worked with Matt on a consulting basis.. gave extremely helpful and knowledgable advice. Would highly recommend.
Michael Ländin,5,Great and very creative producer to work with!
Gina,5,"Matthew is a gem, so creative, talented and awesome to work with!"
Cameron Liddell,5,"This is the second track I’ve done with Matthew, showed it to a couple of friends before I release it and they can’t stop dancing. Matthew does great work, hire him. Your fans will thank you."
Paul W.,5,Love working with him! Good communication and skills highly recommended!
Maria Elena Little,5,I just love the way that this song turned out! It is always a pleasure to work with Matthew!
Maria Elena Little,5,"I've lost track of how many times I've worked with Matthew now, he has become my 'go to guy'! He is an awesome producer!"
Henrik N.,5,"I was very happy working with Matthew. He was listening very carefully to my suggestions along the way, and he included them in the mix. He is definitely a professional and he knows how to use his gear. Therefore the mix sounds really great .. it sounds like a record. I can recommend him to everybody, who wants to improve their demos/recordings and enjoy a top level sound."
Ashley Sienna,5,Matt is an incredible producer that can take a song and turn it into an immersive sound experience. He's got an excellent ear and is very easy to work with. Definitely recommend him!!! Two thumbs up!!!
Stefano G.,5,Matthew is the best producer you can find! Super talented and very professional. We worked together on my new EP from start to finish and it sounds AMAZING! He created my new sound! Had a chance to work in person at his Studio. Matthew is my Producer!
Matt S.,5,"Anytime a producer/writer/vocalist has credits with OneRepublic that's a mike drop testament to quality work in my opinion. But I have now experienced that first hand working on this song with Matthew. Easy to work with, quality product. Enough said."
Maria Elena Little,5,Matthew took my idea for the song and made it sound even better than I imagined. He made the vocals sound great. I love working with him!
Lola Rhodes,5,This was my first time working with a producer here on Soundbetter and I'm really happy with the results. I can highly recommend working with Matthew! He has a great ear and takes direction very well.
Paul W.,5,"Matthew is very hard working and he has a lot of patience for his customers that is a big help. Also, not to mention his brilliant talent and top class skills!"
Sarantos,5,Very professional and clearly great at what he does. Easy to work with and would use again!
Maria Elena Little,5,It was great to work with Matthew again! He is a superb producer and an amazingly talented engineer. Looking forward to working with him on my new EP!
Cameron Liddell,5,"Great work, provided exactly what i was looking for and then some."
Kelly L.,5,"Matthew was great to work with, very patient and understanding and a breeze to communicate with. He really listened to what I had to say and was flexible in adapting changes. (Thank you Matthew!) "
Aman V.,5,It was a pleasure working with Matthew! He was very responsive and delivered exactly what I was looking for!
sunny s.,5,Brilliant producer
Zaiden Rendon,5,Matthew deserves more than 5 stars. No joke.
Kyron We,5,It was a pleasure working with Matthew. He is a creative out of the box thinker.
Andres B.,5,Matthew is incredible. He produced exactly what we wanted. We look forward to working with him again in the near future!
Michael Ländin,5,Great to work with!
Maria Elena Little,5,Matthew really listened to what I wanted and made my song better than I could have imagined! He was incredibly patient and as always very professional. This was my fifth project with him and I look forward to many more!.
jeremy b.,5,"I didn't realize how muddy my track was before Matthew wielded his sorcery upon it. Seriously, if you want to clean up a track, Matthew will do so expertly. Also he'll work with you to get to get a combination of what you want and what he thinks shines in the work. Really amazing experience."
Joanna,5,"Matthew is really great and easy to work with and has a sharp talent for steering a song, and developing a different cool vibe- totally recommend Matt for a project you're working on and want a fresh voice!"
Sally K,5,"Matt was great to work with! Very patient, responsive, listened to what i wanted, and produced a great track. The track is really catchy and im super happy with it . I will definitely be working with Matt again in future!"
Emilio,5,Matthew is such a great professional and producer. He has been so responsive during the whole process and he was very patient by implementing all the changes that were suggested after each revision. We finally got a very professional production that perfectly fits with the influences required. It was a pleasure working with him!
Vincent Mann,5,Matthew is an incredible producer. I really enjoyed his creative process and learned a lot along the way. He has a lot of great techniques and really helps you to work efficiently. He went above and beyond. Thanks again!!
Britt Iwaasa,5,Matthew is really creative and talented with sounds and melodies. Very professional and easy to communicate with. Thank you!
Britt Iwaasa,5,"Matthew is very professional, patient, and always good to work with. Thanks again!"
Daniel F.,5,"My second project with Matthew. Absolutely amazing, and absolutely easy working with him!"
Zaiden Rendon,5,Quality as always!
Lorenzo,5,Matthew is an excellent producer. He managed to execute my vision perfectly. I will definitely work with him again.
Stephen Moyer,5,It was a pleasure working Matthew. He's got a good ear and great taste overall.
Daniel F.,5,"By far, the best mixer to work with, not to mention his unending dedication and patience to make great quality music! His keen ears were my second opinion to rely on. Working with Mathew, I must say, was a smooth ride, because he made it so. I look forward to doing more projects with Matthew! Whether it's producing, mixing, or mastering, hire him."
Rob Price,5,Matthew's patience was incredible on this project. Unfortunately my communication wasn't always as good as I wanted due to many personal circumstances getting in the way but he was a top pro and did a fantastic job. Hire him!
Maria Elena Little,5,Matthew is amazing! He made my song sound great! I look forward to continuing to work with him.
Britt Iwaasa,5,Matthew has amazing vision and creativity with music. He very professional and reflects that in every interaction. Thanks Matthew!
Andrew S,5,Matthew was great to work with!
Zaiden Rendon,5,I asked Matthew to give this track a more 'cinematic' vibe and he did just that! Got's to be the most effective and timely person I've had the pleasure of working with!!! Definitely looking for future work!!!
Gina,5,"Matthew was awesome to work with, is creative, professional and only settles for the best. can't wait to work with him again!"
Dmitry,5,Matthew is brilliant musician and producer. He created great music for my song and the instrumental arrangement is amazing. I am getting great reviews for the music Matt produced. Definitely will come back for more great music and would recommend to anyone.
Maria Elena Little,5,I sent Matthew a track for it to be mixed and mastered and it sounds amazing! He is a superb engineer.
Maria Elena Little,5,"Matthew is an amazing producer. He is not only very talented, but he listens to what the artist wants and makes it happen. I look forward to continuing to work with him."
Dmitry,5,Happy with the work. Will come back again.
January,5,He is real professional producer..! He will make you 100% happy with your song..!
V,5,"I love this guys production, easily one of the best people I've worked with! Matt pays attention to detail and can capture the sound that you need. Looking forward to working with him again many times more."
January,5,"Surely there is a strong reason about his abilities that artists like Taylor Swift , Maroon 5 , One republic , Ariana Grande and others have worked with him.He is Awesome...! Great..!"
Hans Jablonski,5,Thank you Matthew. Great work. 5 star for you. Fanastic work. Great communication.
Neethusha Cherckal,5,"When I approached producers for working on my song, I wasn't very sure I'd get what I wanted. But Matthew nailed it! Everything about the production from each guitar riff to the percussion used, were just perfect for the song. Absolutely how I imagined it when I wrote the song. I have had my musician friends listen to it, they love it. Thanks Matt!"
Lindsey Leigh,5,I immediately started another project with Matt the day my last one finished! He is very professional and talented and I'm always happy to work with him.
January,5,Me and Matthew are working on my new album that he is helping me for producing track and vocal melody. He is very talented and i really believe his quality is higher than everyone is soundbetter website.
Ramon Martelle,5,"Matthew did an amazing job with my track. The sound is current, and fits my writing style for this particular record well. He was professional and kept me updated along the way to get my input!"
Matteo S.,5,"Matthew and I completed four songs together. He is the sole producer on my E.P. Matthew not only produced the tracks but also did much of the comping, tuning and editing, as well as mixing and mastering. A man of many talents Matthew enhanced my songs and was extremely communicative, working hard to make sure my vision was accomplished."
January,5,Best producer ever..! Unbelievable..!
Maria Elena Little,5,"Matthew made my song sound better than I could have ever imagined. He is a true professional, with amazing tracks and superb, radio ready production. I am excited to already be working on my next song with him!"
Matteo S.,5,I gave Matthew a hard song to produce but he was up to the task! He was always able to incorporate my suggestions while also working diligently to strengthen the song. Matt will be the sole producer of my E.P.
Pathfinder,5,"Matthew is very enthusiastic in helping out other musicians with his talent. Actually, I inquired about a very minor job for a skilled producer like Matthew, but he took it seriously. He is reliable, quick, and talented. I recommend any other musicians to try him out."
Matteo S.,5,Matthew and I have worked on two songs and the results have been great! As a producer he is able complete my vision while also adding his own personal touch. He is also a great communicator and gets things done in a timely fashion!
January,5,Matthew is really a world class EDM producer like Dj snake and Kygo or Skrillex.. He is a master..!
Louis Torre,5,Amazing Work! Gave him a track of mine to mix & master & it sounds absolutely radio ready polished now! I'm so satisfied! Would recommend him to anyone!
